{
  "$schema": "https://json-schema.org/draft/2020-12/schema",
  "type": "object",
  "additionalProperties": false,
  "required": [
    "schema_version",
    "manifest_id",
    "package_id",
    "synthetic",
    "fetched_at",
    "artifacts"
  ],
  "properties": {
    "schema_version": {
      "const": "collection-1"
    },
    "manifest_id": {
      "type": "string",
      "minLength": 1
    },
    "package_id": {
      "type": "string",
      "minLength": 1
    },
    "synthetic": {
      "type": "boolean"
    },
    "fetched_at": {
      "type": "string",
      "format": "date-time",
      "pattern": "^\\d{4}-\\d{2}-\\d{2}T\\d{2}:\\d{2}:\\d{2}(?:\\.\\d+)?Z$"
    },
    "artifacts": {
      "type": "array",
      "minItems": 1,
      "items": {
        "type": "object",
        "additionalProperties": false,
        "required": [
          "source_id",
          "document_version_id",
          "artifact_sha256",
          "corp_code",
          "fy",
          "rcept_no",
          "consolidation",
          "source_system",
          "locator",
          "status",
          "error_code",
          "fetched_at"
        ],
        "properties": {
          "source_id": {
            "type": "string",
            "minLength": 1
          },
          "document_version_id": {
            "type": "string",
            "minLength": 1
          },
          "artifact_sha256": {
            "anyOf": [
              {
                "type": "string",
                "pattern": "^[0-9a-f]{64}$"
              },
              {
                "type": "null"
              }
            ]
          },
          "corp_code": {
            "type": "string",
            "pattern": "^[0-9]{8}$"
          },
          "fy": {
            "type": "integer"
          },
          "rcept_no": {
            "type": [
              "string",
              "null"
            ]
          },
          "consolidation": {
            "enum": [
              "consolidated",
              "separate",
              "unknown"
            ]
          },
          "source_system": {
            "enum": [
              "DART",
              "integrated_report"
            ]
          },
          "locator": {
            "type": [
              "string",
              "null"
            ]
          },
          "status": {
            "enum": [
              "retrieved",
              "not_available",
              "failed"
            ]
          },
          "error_code": {
            "type": [
              "string",
              "null"
            ]
          },
          "fetched_at": {
            "type": "string",
            "format": "date-time",
            "pattern": "^\\d{4}-\\d{2}-\\d{2}T\\d{2}:\\d{2}:\\d{2}(?:\\.\\d+)?Z$"
          }
        }
      }
    }
  }
}
